reviews,clean_text,Positive,Negative,Neutral,Compound,Sentiment
"""THE VERGE"", Says this is the best to-do list app right now! WELL...I guess it is best to settle for less than best voted app. This app is missing essential bells and whistles unless upgrading to premium. One particular major example is the Archived Projects. This is a premium only feature, however as folks may miss-click and not undo, they will never see what tasks were needed to complete unless they have a great memory, but then if they had a great memory why would they need a task list....",the verge says this is the best todo list app right now welli guess it is best to settle for less than best voted app this app is missing essential bells and whistles unless upgrading to premium one particular major example is the archived projects this is a premium only feature however as folks may missclick and not undo they will never see what tasks were needed to complete unless they have a great memory but then if they had a great memory why would they need a task list,0.164,0.016,0.82,0.9371,positive
"Lots of emails notifications that you can not stop! Most of the features you need - including seeing a completed task - are all in the pro version (needs payment!) Edit after ""Doist"" reply: I mean the email notifications for the due jobs on the lists. They keep filling my email every day and I could not stop them!",lots of emails notifications that you can not stop most of the features you need  including seeing a completed task  are all in the pro version needs payment edit after doist reply i mean the email notifications for the due jobs on the lists they keep filling my email every day and i could not stop them,0.068,0.0,0.932,0.4168,positive
"It was already very irritating to see your latest added tasks being pushed at the bottom and you have to everytime open the app to rearrange. And with new update you can't even open the app from the widget, you have to create a seperate icon which is super super annoying. Probably gonna uninstall the app if this is not fixed soon.",it was already very irritating to see your latest added tasks being pushed at the bottom and you have to everytime open the app to rearrange and with new update you cant even open the app from the widget you have to create a seperate icon which is super super annoying probably gonna uninstall the app if this is not fixed soon,0.138,0.083,0.779,0.6003,positive
"I'm really disappointed with the Wear OS app: * The reminders doesn't works as expected: I hear the notification sound but there is no notification popup, and if I scroll down on the main screen I see ""No notifications"". How am I supposed to know what task I was reminded about? * I can't add a new task with a due date, e.g: ""test 20:10"" because as soon as I type 20 the "":"" button dissapears from the top suggested keys and is not available from the special keys / second keyboard page either (I use the default/google keyboard so that can't be the issue). * The sync is slow, after I added a new todo on the web I had to open the Wear OS app a few times so my new todo also appeared there. Could you maybe add a pull to refresh feature to manully trigger the sync?",im really disappointed with the wear os app  the reminders doesnt works as expected i hear the notification sound but there is no notification popup and if i scroll down on the main screen i see no notifications how am i supposed to know what task i was reminded about  i cant add a new task with a due date eg test  because as soon as i type  the  button dissapears from the top suggested keys and is not available from the special keys  second keyboard page either i use the defaultgoogle keyboard so that cant be the issue  the sync is slow after i added a new todo on the web i had to open the wear os app a few times so my new todo also appeared there could you maybe add a pull to refresh feature to manully trigger the sync,0.042,0.057,0.902,-0.2609,negative
"Revised review: Sometimes we seek out apps to help with deficiencies or make life work out. App was so great and so functional for months, until a few days ago. I was working around the changed, now cumbersome, reschedule/edit/rename tasks process. But Labels beyond a few characters are hidden now. Todoist Labels was The Thing for this app for me, with efficiently visually seeing/grouping tasks. Had made app ahead of many others. App needs more display settings then...to be usable again.",revised review sometimes we seek out apps to help with deficiencies or make life work out app was so great and so functional for months until a few days ago i was working around the changed now cumbersome rescheduleeditrename tasks process but labels beyond a few characters are hidden now todoist labels was the thing for this app for me with efficiently visually seeinggrouping tasks had made app ahead of many others app needs more display settings thento be usable again,0.102,0.0,0.898,0.8186,positive
"Great app. Alas, I'm constantly reminded that ""Hey btw there's a paid version which has the functionality you're looking for : ) "". This is tiresome and the subscription based model just doesn't make any sense. Plus hey! Its expensive.",great app alas im constantly reminded that hey btw theres a paid version which has the functionality youre looking for    this is tiresome and the subscription based model just doesnt make any sense plus hey its expensive,0.102,0.052,0.846,0.4588,positive
"'It's free, forever' but 'reminders are a premium feature.' Hmm. I'm dyspraxic, without much money to waste, and I'm looking for a to-do list app to help with this. Without reminders, this app is functionally useless to me. Disappointed that you've opted to content-carve to this extent, and I'd argue your claim of being free is misleading. Please reconsider which features to gatekeep, because locking basic functions behind a paywall makes me *less* likely to support you financially.",its free forever but reminders are a premium feature hmm im dyspraxic without much money to waste and im looking for a todo list app to help with this without reminders this app is functionally useless to me disappointed that youve opted to contentcarve to this extent and id argue your claim of being free is misleading please reconsider which features to gatekeep because locking basic functions behind a paywall makes me less likely to support you financially,0.163,0.183,0.654,-0.4489,negative
"I bet it would work for someone who mainly needs a list, but personally I need alarms and reminders to keep me on track. I was looking for one when I found todoist that was advertised as having a reminder setting. I was disappointed to find out that the reminder function was a paid function, so I uninstalled the app. I bet it would work for someone else, but not for me",i bet it would work for someone who mainly needs a list but personally i need alarms and reminders to keep me on track i was looking for one when i found todoist that was advertised as having a reminder setting i was disappointed to find out that the reminder function was a paid function so i uninstalled the app i bet it would work for someone else but not for me,0.0,0.102,0.898,-0.7783,negative
"very disappointed after i got premium, i was hoping to be able to set goals on a weekly schedule planner but none of that. instead, it keeps tracks on how many tasks i completed overall. but who cares about that? it isn't gonna help me at all. the fact that there isn't any trial to see if we like it or not and we have to pay just to regret it is disappointing.",very disappointed after i got premium i was hoping to be able to set goals on a weekly schedule planner but none of that instead it keeps tracks on how many tasks i completed overall but who cares about that it isnt gonna help me at all the fact that there isnt any trial to see if we like it or not and we have to pay just to regret it is disappointing,0.108,0.173,0.719,-0.674,negative
The new update is awful. I have to do so many extra clicks to perform basic operations like moving tasks to different days. Multi-select doesn't work any more and the widget is totally broken. Rescheduling anything from the widget locks it up completely.,the new update is awful i have to do so many extra clicks to perform basic operations like moving tasks to different days multiselect doesnt work any more and the widget is totally broken rescheduling anything from the widget locks it up completely,0.052,0.133,0.814,-0.5984,negative
"I tried the free version. I liked the way, that you are writing the day to remind you and it set itself, but the free version doesn't support calendar and for me this is a big minus. I prefer to use Google task app, that signs up with calendar and reminds you for the task.",i tried the free version i liked the way that you are writing the day to remind you and it set itself but the free version doesnt support calendar and for me this is a big minus i prefer to use google task app that signs up with calendar and reminds you for the task,0.146,0.049,0.805,0.6821,positive
"I'd like it except the widget is the most important feature for me. It displayed my inbox for about a week and now comes up blank. The tasks are there tho. I can read them if I open them, or open the app. :-( You're not the only organizer with this problem tho. Android 9.",id like it except the widget is the most important feature for me it displayed my inbox for about a week and now comes up blank the tasks are there tho i can read them if i open them or open the app  youre not the only organizer with this problem tho android,0.084,0.057,0.859,0.12,positive
"Way to easy to lose your task as they disapear when checked. Example, I got distracted for 10 seconds with my phone in my hand and ToDoIst app open and when I looked back at my phone 4 task had disappeared and I'm left trying to remember wish task it was! Really bad for an app that suppose to help you organize. I'm uninstalling because of this.",way to easy to lose your task as they disapear when checked example i got distracted for  seconds with my phone in my hand and todoist app open and when i looked back at my phone  task had disappeared and im left trying to remember wish task it was really bad for an app that suppose to help you organize im uninstalling because of this,0.149,0.14,0.712,0.1796,positive
"I reviewed the software to provide 80 projects in free version and collaborators. On installing the product today, it has reduced the projects and collaborators all of a sudden. I was so confused looking at the pricing page show different things all of a sudden to understand there has been an update. Though the app is good, but it's targeted towards premium users more than the basic users. Wouldn't serve the purpose. I guess I would have to program my own to get pretty basic features in an app!",i reviewed the software to provide  projects in free version and collaborators on installing the product today it has reduced the projects and collaborators all of a sudden i was so confused looking at the pricing page show different things all of a sudden to understand there has been an update though the app is good but its targeted towards premium users more than the basic users wouldnt serve the purpose i guess i would have to program my own to get pretty basic features in an app,0.095,0.023,0.882,0.751,positive
"Giving Todoist a 2-star review because the sync issues are so frequent that it makes the app a pain to use. Real shame because the interface is really sleek and there are some great features. Sync issues I've encountered: - I try to add a task and it doesn't actually add because it didn't sync for some reason - I try to add a task using the laptop app and it doesn't add because sync issue - I try to move a task up in the list and it doesn't work, goes back to initial position",giving todoist a star review because the sync issues are so frequent that it makes the app a pain to use real shame because the interface is really sleek and there are some great features sync issues ive encountered  i try to add a task and it doesnt actually add because it didnt sync for some reason  i try to add a task using the laptop app and it doesnt add because sync issue  i try to move a task up in the list and it doesnt work goes back to initial position,0.069,0.068,0.863,0.0258,neutral
Your reminder system could use some improvements please. If we could just click the clock and a watch would pop up where we just input the time or you suggest intervals of 30 min or 1 hour. At the moment we have to type out the time and it's not efficient. I use the app for my sales team 8 hours a day. Please do something about this.,your reminder system could use some improvements please if we could just click the clock and a watch would pop up where we just input the time or you suggest intervals of  min or  hour at the moment we have to type out the time and its not efficient i use the app for my sales team  hours a day please do something about this,0.103,0.035,0.863,0.5526,positive
"Great app that suffers from the most annoying design flaw. Every time I create a task, it goes to the bottom of the list. I always want the task at the top so I can see it. That's the whole point of using a to do list. So I have to drag the task, one by one to the top. Makes me crazy.",great app that suffers from the most annoying design flaw every time i create a task it goes to the bottom of the list i always want the task at the top so i can see it thats the whole point of using a to do list so i have to drag the task one by one to the top makes me crazy,0.159,0.153,0.688,-0.1423,negative
Conatant sync problems. Throwing errors when trying to view activity log. Not all actions of collaborators are logged. For example collaborator completed a task and it doesn't show in notifications. But sometimes it does. All in all very unpredictable app.,conatant sync problems throwing errors when trying to view activity log not all actions of collaborators are logged for example collaborator completed a task and it doesnt show in notifications but sometimes it does all in all very unpredictable app,0.0,0.088,0.912,-0.3716,negative
"After using this product for a month on the computer and my phone, I have found it to be laggy and frustrating to deal with. The free option isn't as good as other options such as Microsoft To Do and the paid solution offers little more than these either.",after using this product for a month on the computer and my phone i have found it to be laggy and frustrating to deal with the free option isnt as good as other options such as microsoft to do and the paid solution offers little more than these either,0.104,0.098,0.798,0.0757,positive
"While everything else about this app is good, the process of scheduling a task is frustrating. Half of the time, it fails to recognize what I'm trying to set. You should just bring back the old scheduling layout from a few years ago. That was easy.",while everything else about this app is good the process of scheduling a task is frustrating half of the time it fails to recognize what im trying to set you should just bring back the old scheduling layout from a few years ago that was easy,0.113,0.111,0.777,0.0258,neutral
"The widget was, finally, perfect. So of course someone had to make it less functional. Because obviously, a 3x2 widget tucked away in a corner of the home screen isn't a thing that a person should be allowed to have. No, clearly, only a widget that's required to take up MORE than half the screen will do. Is there seriously a good reason the widget can't be resized to something sensible any more? Because I can't think of one. And I am seriously frustrated.",the widget was finally perfect so of course someone had to make it less functional because obviously a x widget tucked away in a corner of the home screen isnt a thing that a person should be allowed to have no clearly only a widget thats required to take up more than half the screen will do is there seriously a good reason the widget cant be resized to something sensible any more because i cant think of one and i am seriously frustrated,0.108,0.104,0.788,0.3182,positive
"I like the app. It works, it's functional, and it's great. However, one thing still strikes me down. Why the hell are reminders a paid feature? Seriously, what's a To-Do app without reminders? I could use even my calendar, or almost any other app, and that would too have reminders, for free. So why should I pay for such a basic feature on a fully fledged app?",i like the app it works its functional and its great however one thing still strikes me down why the hell are reminders a paid feature seriously whats a todo app without reminders i could use even my calendar or almost any other app and that would too have reminders for free so why should i pay for such a basic feature on a fully fledged app,0.135,0.143,0.722,0.1119,positive
"App is not for me. I paid $4.00 for 1 month of Premium service and is still shows I am using the free app. I immediately contacted customer service (twice), and it's been more than 2 weeks into the 1 month I paid for and I still have not received a response from anyone at Todoist. I'm still trying to figure out how to customize this app to suit my needs, but since I don't have the Premium app in order to do that, I will be uninstalling this app.",app is not for me i paid  for  month of premium service and is still shows i am using the free app i immediately contacted customer service twice and its been more than  weeks into the  month i paid for and i still have not received a response from anyone at todoist im still trying to figure out how to customize this app to suit my needs but since i dont have the premium app in order to do that i will be uninstalling this app,0.027,0.0,0.973,0.2846,positive
"it's clear to me that this is the best todo app, and I've used it for a long time, but having reminders be a premium feature is just unreasonable as it's impossible to use a todo app without them. I'll be switching to TickTick.",its clear to me that this is the best todo app and ive used it for a long time but having reminders be a premium feature is just unreasonable as its impossible to use a todo app without them ill be switching to ticktick,0.163,0.0,0.837,0.7505,positive
"I am not receiving my notifications on any of my tasks/projects I have scheduled, so I end up missing out on things I want to take care of. I have it turned on in Settings. Why is that?... I utilize the Smart Schedule tool, but still no notification. Pls help or fix.",i am not receiving my notifications on any of my tasksprojects i have scheduled so i end up missing out on things i want to take care of i have it turned on in settings why is that i utilize the smart schedule tool but still no notification pls help or fix,0.188,0.084,0.727,0.5526,positive
"The premium version might be good but the free version is more restricted then other to-do apps, you can not even use the labels/ tags function without paying. If you are looking for a free todo list this is probably not the app for you.",the premium version might be good but the free version is more restricted then other todo apps you can not even use the labels tags function without paying if you are looking for a free todo list this is probably not the app for you,0.198,0.07,0.731,0.7912,positive
"Maybe it works for some people, but this was absolutely the worst 'to do list' app I have tried! Every time I opened it, therr was a 'feature' blocking my use. The ultimate problem was finding no task delete function.",maybe it works for some people but this was absolutely the worst to do list app i have tried every time i opened it therr was a feature blocking my use the ultimate problem was finding no task delete function,0.0,0.324,0.676,-0.9503,negative
"Paying a monthly fee is not acceptable IMO. I would gladly pay a one time fee for it. I still use apps from years ago that are still used from one phone to the next. If I had to pay a monthly fee to keep those this whole time would be way too much for what they're worth. This is a good app, with plenty of features, but not worth $36 a year.",paying a monthly fee is not acceptable imo i would gladly pay a one time fee for it i still use apps from years ago that are still used from one phone to the next if i had to pay a monthly fee to keep those this whole time would be way too much for what theyre worth this is a good app with plenty of features but not worth  a year,0.109,0.057,0.834,0.5528,positive
"This was really good until the app just stopped working. You'd start the app and just get a black black page, ending up with warning message after warning message saying that the app had stopped working. Tried restarting the app and the phone and the message wouldn't stop appearing.",this was really good until the app just stopped working youd start the app and just get a black black page ending up with warning message after warning message saying that the app had stopped working tried restarting the app and the phone and the message wouldnt stop appearing,0.091,0.154,0.754,-0.3651,negative
"New update has lost the ability to click on the widget and open the list full screen. The font is smaller, and ticking off an item on the widget has became more difficult. Please fix, five stars otherwise.",new update has lost the ability to click on the widget and open the list full screen the font is smaller and ticking off an item on the widget has became more difficult please fix five stars otherwise,0.111,0.116,0.773,-0.0553,negative
"Since the latest update, the todoist widget which shows the list of to do items is refreshing constantly causing Google Play services to drain the battery. Both phone and tablet versions are affected. This means I cannot use the app in my customary way affecting my workflow.",since the latest update the todoist widget which shows the list of to do items is refreshing constantly causing google play services to drain the battery both phone and tablet versions are affected this means i cannot use the app in my customary way affecting my workflow,0.05,0.033,0.917,0.2023,positive
"Something wrong with latest update? Android widgets are flickering, deleting and re-adding doesn't help.",something wrong with latest update android widgets are flickering deleting and readding doesnt help,0.0,0.309,0.691,-0.6551,negative
"Fantastic app but ever since the latest ""bug fixing"" update the widget won't stop flickering like crazy. I may have to uninstall it so it doesn't give me migraines, it would be disappointing if it came to that.",fantastic app but ever since the latest bug fixing update the widget wont stop flickering like crazy i may have to uninstall it so it doesnt give me migraines it would be disappointing if it came to that,0.099,0.216,0.685,-0.7531,negative
"If you accidentally press complete on a task, and you miss the 3 second ""undo"" popup, your task list is gone forever. This is a really bad oversight if you make lists for things like grocery shopping or house chores.",if you accidentally press complete on a task and you miss the  second undo popup your task list is gone forever this is a really bad oversight if you make lists for things like grocery shopping or house chores,0.058,0.18,0.762,-0.6478,negative
"What good is a task app if it can't remind you to do a thing? I understand that the developers need to make ends meet, but reminders not being free is really obnoxious and prevents me from switching to it full-time.",what good is a task app if it cant remind you to do a thing i understand that the developers need to make ends meet but reminders not being free is really obnoxious and prevents me from switching to it fulltime,0.083,0.175,0.743,-0.7349,negative
"Very good app. I have recommended this to so many of my friends. However, I have paid for an annual subscription for the pro version, but then a month later, I'm unable to use the original pro settings like having multiple projects and setting reminders. Due to new packages introduced to the app, it appears I don't have the access that I've originally paid for, and I've been prompting me to upgrade again. I've tried multiple times to make contact with them to no avail. Please help me understand",very good app i have recommended this to so many of my friends however i have paid for an annual subscription for the pro version but then a month later im unable to use the original pro settings like having multiple projects and setting reminders due to new packages introduced to the app it appears i dont have the access that ive originally paid for and ive been prompting me to upgrade again ive tried multiple times to make contact with them to no avail please help me understand,0.186,0.029,0.785,0.9253,positive
"This app is as useless as Google Tasks which doesn't send any notifications to remind me of the tasks it asks me to pay for it to send notifications, useless.",this app is as useless as google tasks which doesnt send any notifications to remind me of the tasks it asks me to pay for it to send notifications useless,0.0,0.206,0.794,-0.7184,negative
