reviews,clean_text,Positive,Negative,Neutral,Compound,Sentiment
I like using this for personal use and wish I could have more lists instead of just 6.,i like using this for personal use and wish i could have more lists instead of just,0.286,0.0,0.714,0.6369,positive
It's a real good app for organising your tasks and setting different times for each tasks. I'm giving 4⭐ because notification is only present in the pro version. Lest I forget 🤩 it also ranks you based on your performance. You can also set your goals like how many goals you wanna achieve every day and week. Finally there are no ads. Trust me it's a nice app.,its a real good app for organising your tasks and setting different times for each tasks im giving  because notification is only present in the pro version lest i forget  it also ranks you based on your performance you can also set your goals like how many goals you wanna achieve every day and week finally there are no ads trust me its a nice app,0.188,0.055,0.757,0.8689,positive
Over all a great app but I have tasks in Google calendar that are set to repeat every 4 weeks but when I sync them to Todoist they adjust to repeat weekly which is frustrating because they needlessly fill up my inbox. I have reported the issue as a ticket but I haven't yet received a reply. If they fix that I will happily buy an annual subscription (currently just trying it for one month).,over all a great app but i have tasks in google calendar that are set to repeat every  weeks but when i sync them to todoist they adjust to repeat weekly which is frustrating because they needlessly fill up my inbox i have reported the issue as a ticket but i havent yet received a reply if they fix that i will happily buy an annual subscription currently just trying it for one month,0.1,0.052,0.848,0.5574,positive
Todoist is my go to get-your-you-know-what-together app. It's super customizable which I really like. Also like being able to see my events/to-do's for the upcoming week. Only complaint is I wish there was a sort of calendar view where I could see a month at a time. I still use a paper calendar for that.,todoist is my go to getyouryouknowwhattogether app its super customizable which i really like also like being able to see my eventstodos for the upcoming week only complaint is i wish there was a sort of calendar view where i could see a month at a time i still use a paper calendar for that,0.216,0.039,0.745,0.8746,positive
"Works fine, but not very handy with active usage of one-handed mode gesture",works fine but not very handy with active usage of onehanded mode gesture,0.327,0.0,0.673,0.6537,positive
"Editing my review now I've used this more: while I still think it's poor that the website says the free account supports 80 projects, when it is in fact only 5, the app, both on mobile and desktop is excellent. I've adapted to the limitation and found the app to very useful, I particularly like the natural language method of setting due dates/recurring tasks. Still, one star off for the mis-leading messaging!",editing my review now ive used this more while i still think its poor that the website says the free account supports  projects when it is in fact only  the app both on mobile and desktop is excellent ive adapted to the limitation and found the app to very useful i particularly like the natural language method of setting due datesrecurring tasks still one star off for the misleading messaging,0.216,0.094,0.69,0.8889,positive
"The app is amazing and easy to use. I am finding that I am able to manage my time and activities efficiently and having more time on my hand that I am previously used to. Its also great because i can access it on all my devices. The app is an amazing concept, however it is disappointing that the free version is alot more limited that I thought. That being said it is an amazing tool to have at all times. I would recommended it to anyone and everyone.",the app is amazing and easy to use i am finding that i am able to manage my time and activities efficiently and having more time on my hand that i am previously used to its also great because i can access it on all my devices the app is an amazing concept however it is disappointing that the free version is alot more limited that i thought that being said it is an amazing tool to have at all times i would recommended it to anyone and everyone,0.275,0.05,0.674,0.975,positive
"EDIT: After the fair dev reply and reflection, I can't deny Todoist's top quality and effort +1 star :) does what it aims to do very well, perhaps the best. However, I feel users trying to ""become"" organised, aren't going to benefit as much as users who ""already"" are. A little counter intuitive but the app does feel like it's an all in commitment, or nothing (just IMO, after a couple years of use). This may feel like another stressor to some. Again, it's a brilliant addition for the right user.",edit after the fair dev reply and reflection i cant deny todoists top quality and effort  star  does what it aims to do very well perhaps the best however i feel users trying to become organised arent going to benefit as much as users who already are a little counter intuitive but the app does feel like its an all in commitment or nothing just imo after a couple years of use this may feel like another stressor to some again its a brilliant addition for the right user,0.221,0.066,0.714,0.9416,positive
"I was delighted by this app. Hence, i went for the premium subscription. There are two things i request the developers to look into. 1. There must be a proper notification. Better if we get some kind of alarm kind of notification. Right now, the notification feature is not that effective. 2. I have done integration with the Google Calendar. But if you put a task on a particular date and time, it is added in the calendar as an one hour task by default. Later, i go to the calendar to change it",i was delighted by this app hence i went for the premium subscription there are two things i request the developers to look into  there must be a proper notification better if we get some kind of alarm kind of notification right now the notification feature is not that effective  i have done integration with the google calendar but if you put a task on a particular date and time it is added in the calendar as an one hour task by default later i go to the calendar to change it,0.047,0.041,0.912,0.1221,positive
"Great app, easy to use with friendly interface and customise options. But didn't stick to it for personal use as free version lacks essential features (like reminders, history, backup, limited labels, etc.). I think paid version has to offer something on top of free standard features (included to pre-installed Google apps) not charging for them.",great app easy to use with friendly interface and customise options but didnt stick to it for personal use as free version lacks essential features like reminders history backup limited labels etc i think paid version has to offer something on top of free standard features included to preinstalled google apps not charging for them,0.302,0.034,0.664,0.9559,positive
"Good for keeping lists of tasks and working through them. It is worth taking time to learn the different ways to use and organise the app. Sometimes it seems to be working against me eg in certain views, I can't drag tasks up and down a list or can't see them ordered by subject. [Edit follows, to respond to Todoist's reply:] Thanks for replying. Yes, as you say, ""sorting in filtered views is not possible"". Or to use non-developer language, ""Ugghhh, why can't I sort this list by project or in another way that suits me?"" This is the one thing that I dislike strongly about an otherwise excellent app. Wunderlist had better sorting and Tick Tick has it. I would love to see this change in Todoist.",good for keeping lists of tasks and working through them it is worth taking time to learn the different ways to use and organise the app sometimes it seems to be working against me eg in certain views i cant drag tasks up and down a list or cant see them ordered by subject edit follows to respond to todoists reply thanks for replying yes as you say sorting in filtered views is not possible or to use nondeveloper language ugghhh why cant i sort this list by project or in another way that suits me this is the one thing that i dislike strongly about an otherwise excellent app wunderlist had better sorting and tick tick has it i would love to see this change in todoist,0.191,0.018,0.791,0.97,positive
"To do items, arranged into projects, can be one off or repeating and can optionally be assigned a date (e.g. a fortnightly reminder on a given day to put out your recycling for collection, a shopping list without dates). Relative days are automatically detected - e.g. ""tod"" for today, a generally helpful feature until you try to remember to call Tom, which results in an item ""call"" for the next day. Handy voice assistant integration to add items to your shopping list while preparing a meal.",to do items arranged into projects can be one off or repeating and can optionally be assigned a date eg a fortnightly reminder on a given day to put out your recycling for collection a shopping list without dates relative days are automatically detected  eg tod for today a generally helpful feature until you try to remember to call tom which results in an item call for the next day handy voice assistant integration to add items to your shopping list while preparing a meal,0.035,0.0,0.965,0.4215,positive
"I really like this app. I use if as a widget on my phone so I can easily see what else I have to do for the day. BUT, I recently got a fit bit versa 3, and the apps will not sync. I keep getting the ""getting started"" orange screen, asking me to allow permission for fit for todoist app on the fitbit app. Everyone is switched to on, and it won't work. Even paid for the Fitbit app. Deleted both todoist apps, turned off both devices and still nothing. I emailed the app yest., waiting on responss",i really like this app i use if as a widget on my phone so i can easily see what else i have to do for the day but i recently got a fit bit versa  and the apps will not sync i keep getting the getting started orange screen asking me to allow permission for fit for todoist app on the fitbit app everyone is switched to on and it wont work even paid for the fitbit app deleted both todoist apps turned off both devices and still nothing i emailed the app yest waiting on responss,0.13,0.0,0.87,0.8906,positive
"The app is so good at all!, but when I add a task in other devices (my cellphone), the app just crash, issue that isn't occurred in my laptop, and mi cellphone is a xiaomi that is not old.",the app is so good at all but when i add a task in other devices my cellphone the app just crash issue that isnt occurred in my laptop and mi cellphone is a xiaomi that is not old,0.059,0.089,0.852,-0.2913,negative
Love the app cause it is available on pc too. I have a reauest to the team. Please add an option that a task we add comes everyday.(same task every day) please!!!,love the app cause it is available on pc too i have a reauest to the team please add an option that a task we add comes everydaysame task every day please,0.253,0.0,0.747,0.8316,positive
"This is a great app! The integration with Google Calendar is also a great feature, though it would be nice if it could ""strike through"" the event in Calendar once the item is marked complete in Todoist. In the way it is built right now you need to choose if you want to just keep or delete the Calendar events corresponding to completed tasks.",this is a great app the integration with google calendar is also a great feature though it would be nice if it could strike through the event in calendar once the item is marked complete in todoist in the way it is built right now you need to choose if you want to just keep or delete the calendar events corresponding to completed tasks,0.174,0.021,0.805,0.8957,positive
"If you're having trouble with the last update causing your widget to flash, just go into the app settings and log out of your account and back in. That fixed it for me.",if youre having trouble with the last update causing your widget to flash just go into the app settings and log out of your account and back in that fixed it for me,0.0,0.078,0.922,-0.4019,negative
"When I try to move a todo item to another project and section using the ""Move to"" button there was an option earlier to move to another section, but now it shows only projects list. Sections are not shown in the list anymore. Can you please check this. This was really helpful for organization.",when i try to move a todo item to another project and section using the move to button there was an option earlier to move to another section but now it shows only projects list sections are not shown in the list anymore can you please check this this was really helpful for organization,0.124,0.0,0.876,0.7958,positive
very useful app,very useful app,0.615,0.0,0.385,0.4927,positive
Needs to pay to set reminders,needs to pay to set reminders,0.0,0.219,0.781,-0.1027,negative
"I use this app as a student to manage my assignments etc. and it does it pretty good but the only problem I have is that it doesn't permanently show completed tasks. They introduced it to web and pc but not for the Android, Would be 5/5 if they add that.",i use this app as a student to manage my assignments etc and it does it pretty good but the only problem i have is that it doesnt permanently show completed tasks they introduced it to web and pc but not for the android would be  if they add that,0.078,0.069,0.853,-0.128,negative
"Great App, really love it so far There's just one main problem, and it's the lack of right-to-left writing support. I don't need the entire app to be in Hebrew, but when I write in Hebrew the text should move to the right instead of staying at the left like english. Are there plans to add right-to-left writing support?",great app really love it so far theres just one main problem and its the lack of righttoleft writing support i dont need the entire app to be in hebrew but when i write in hebrew the text should move to the right instead of staying at the left like english are there plans to add righttoleft writing support,0.207,0.052,0.741,0.8872,positive
Wish you could set reminders for upcoming tasks instead of only seeing the task appear on its due date,wish you could set reminders for upcoming tasks instead of only seeing the task appear on its due date,0.13,0.0,0.87,0.4019,positive
"It is great app for tasks listing and keeping track of things, but whenever i try to search for the widget my oneUI home keeps stopping, please look into this problem...",it is great app for tasks listing and keeping track of things but whenever i try to search for the widget my oneui home keeps stopping please look into this problem,0.146,0.162,0.692,-0.15,negative
It's fine.,its fine,0.643,0.0,0.357,0.2023,positive
"There is a bug with recurring tasks. If a task is overdue and it is supposed to reccur on the next day (today), the yesterday task stays as overdue and new task for today won't be there. If I had completed the task yesterday but I did not marked it done, I will have to reschedule the task for today instead of marking it done. If I mark it done instead, the yesterday task is completed and today's task does not show up.",there is a bug with recurring tasks if a task is overdue and it is supposed to reccur on the next day today the yesterday task stays as overdue and new task for today wont be there if i had completed the task yesterday but i did not marked it done i will have to reschedule the task for today instead of marking it done if i mark it done instead the yesterday task is completed and todays task does not show up,0.0,0.0,1.0,0.0,neutral
"Works fine, but not very handy with active usage of one-handed mode gesture",works fine but not very handy with active usage of onehanded mode gesture,0.327,0.0,0.673,0.6537,positive
"I bought a new planner around the same time I started using Todoist. I used the planner for about a week. I find with Todoist, the planner is no longer useful to me. The use of tags helps me organize my work and plan my day. It's also very easy to move a task from one day to the next. In my planner, it seemed I was constantly re-writing tasks to the next day and would often lose sight of them. I also like that I can keep notes within a task. This helps me remember any progress or delays.",i bought a new planner around the same time i started using todoist i used the planner for about a week i find with todoist the planner is no longer useful to me the use of tags helps me organize my work and plan my day its also very easy to move a task from one day to the next in my planner it seemed i was constantly rewriting tasks to the next day and would often lose sight of them i also like that i can keep notes within a task this helps me remember any progress or delays,0.162,0.048,0.79,0.8932,positive
One of the best to-do list apps i have used.,one of the best todo list apps i have used,0.344,0.0,0.656,0.6369,positive
easy to handle,easy to handle,0.592,0.0,0.408,0.4404,positive
"This app is the best todo list app. I have used this for almost 5 years I think, and it's been great for me and my husband. A todo list cannot get better than this one. However, my life circumstances have changed. This only works when I can do things, not when I want to give jobs to others. I have a kid now, and there are the family schedule, individual member's schedules, plus important things to always have in hand (notes), etc. Thank you todoist and good bye. [Edit below] We've moved to Twist",this app is the best todo list app i have used this for almost  years i think and its been great for me and my husband a todo list cannot get better than this one however my life circumstances have changed this only works when i can do things not when i want to give jobs to others i have a kid now and there are the family schedule individual members schedules plus important things to always have in hand notes etc thank you todoist and good bye edit below weve moved to twist,0.185,0.036,0.78,0.9439,positive
good,good,1.0,0.0,0.0,0.4404,positive
"🕳️💤🙊🙉🙈🌞🌝🌚🌜🌛🤑😇😲😳🤯😖😣😫🤏👌💦💨💥✨💫🔥💯🎆🎇🎁🎀🎂🎈🎊🎉💅🌛🌜🌚🌝🌞🌞🌞🌞🌞🙈🙉🙊🤑🤑🤑😇😇🙈🙈..,, ,,",,0.0,0.0,0.0,0.0,neutral
"I liked this app and recently purchased the subscription but i felt the needfor some features. like Filters are still limiting, multi sort can't be done. Sub-Sections can't be created and also sections can't be favourited. Plz see it's possible to implement.",i liked this app and recently purchased the subscription but i felt the needfor some features like filters are still limiting multi sort cant be done subsections cant be created and also sections cant be favourited plz see its possible to implement,0.115,0.077,0.807,0.4033,positive
"Good app, but has some anoying features, f.e. I get a notification in the morning about not having any tasks today. That's anoying spam. All I can do is turn off notifications all together.",good app but has some anoying features fe i get a notification in the morning about not having any tasks today thats anoying spam all i can do is turn off notifications all together,0.057,0.095,0.848,-0.3182,negative
I like using this for personal use and wish I could have more lists instead of just 6.,i like using this for personal use and wish i could have more lists instead of just,0.286,0.0,0.714,0.6369,positive
Great app to keep me up. Pls add more priority colour badges. Atleast 1 or 2 more. We need it. Pls,great app to keep me up pls add more priority colour badges atleast  or  more we need it pls,0.295,0.0,0.705,0.6908,positive
cant change my email it just gives me an error message,cant change my email it just gives me an error message,0.0,0.213,0.787,-0.4019,negative
really good,really good,0.762,0.0,0.238,0.4927,positive
It would be so great if they add a calendar to this app,it would be so great if they add a calendar to this app,0.323,0.0,0.677,0.7384,positive
"Amazing app, after using tons of todo apps, I'm sticking to this one, checks all the boxes for me.",amazing app after using tons of todo apps im sticking to this one checks all the boxes for me,0.174,0.0,0.826,0.5859,positive
"Please Add the following features: • Allow to group by ""project sections"" in filters • Allow board view for filters • List view to be decluttered and have columns for the different fields (similar to Asana) • Today and upcoming view to not only show tasks assigned to you, but ALL tasks • Change Add Task widget icon • Ability to change the color of the entire task box, based on priority (currently only the bullet changes color) •Priority: ability to change colors, and to add more priority options",please add the following features • allow to group by project sections in filters • allow board view for filters • list view to be decluttered and have columns for the different fields similar to asana • today and upcoming view to not only show tasks assigned to you but all tasks • change add task widget icon • ability to change the color of the entire task box based on priority currently only the bullet changes color •priority ability to change colors and to add more priority options,0.118,0.0,0.882,0.8151,positive
"personally I say it's an awesome app,it helps a lot",personally i say its an awesome appit helps a lot,0.528,0.0,0.472,0.7717,positive
"Great app, only the subscription fee is a bit steep for what's on offer.",great app only the subscription fee is a bit steep for whats on offer,0.255,0.0,0.745,0.6249,positive
Excellent app to keep my tasks in check. Only gripe is that the widget doesn't use the dark theme when I toggle dark theme system wide leaving this one single widget in light mode. Hope it gets fixed soon.,excellent app to keep my tasks in check only gripe is that the widget doesnt use the dark theme when i toggle dark theme system wide leaving this one single widget in light mode hope it gets fixed soon,0.155,0.0,0.845,0.765,positive
This is a great app. One thing I suggest is time ranges. Im getting a bit frustrated with the fact that I cant make an appointment from say 2:00pm to 4:30pm for example. It would help to have time blocks to visualize my schedule. Would this be possible?,this is a great app one thing i suggest is time ranges im getting a bit frustrated with the fact that i cant make an appointment from say pm to pm for example it would help to have time blocks to visualize my schedule would this be possible,0.131,0.102,0.768,0.3612,positive
"Overall it met my expectation but do hit a bug. When I try to sort with labels, the app will crash. Cannot reopen until I use the chrome extension in my desktop to remove the sort before it opens again.",overall it met my expectation but do hit a bug when i try to sort with labels the app will crash cannot reopen until i use the chrome extension in my desktop to remove the sort before it opens again,0.0,0.09,0.91,-0.5499,negative
Amazing thank you,amazing thank you,0.863,0.0,0.137,0.743,positive
"The app is so good at all!, but when I add a task in other devices (my cellphone), the app just crash, issue that isn't occurred in my laptop, and mi cellphone is a xiaomi that is not old.",the app is so good at all but when i add a task in other devices my cellphone the app just crash issue that isnt occurred in my laptop and mi cellphone is a xiaomi that is not old,0.059,0.089,0.852,-0.2913,negative
"love it, and I would buy a premium version for one price but im not interested in anymore monthly payment or yearly payments so ill stick with the free version. it's simple and does exactly what I need it to do.",love it and i would buy a premium version for one price but im not interested in anymore monthly payment or yearly payments so ill stick with the free version its simple and does exactly what i need it to do,0.144,0.16,0.696,-0.1929,negative
"Enjoying this app so far, it offers more sorting and organization options and easier due date editing than Google Tasks, which is what I used before. I like how seamless it is to move items to different projects and dates. However, I wish there were more options to see my completed tasks, though: at least an option to show the tasks I completed this week or today... It means a lot to me able to see my completed tasks (I like to SEE my productivity without having to dig for it).",enjoying this app so far it offers more sorting and organization options and easier due date editing than google tasks which is what i used before i like how seamless it is to move items to different projects and dates however i wish there were more options to see my completed tasks though at least an option to show the tasks i completed this week or today it means a lot to me able to see my completed tasks i like to see my productivity without having to dig for it,0.148,0.0,0.852,0.9169,positive
Setting task time on the web app is finicky. Poor UI on the tablet app.,setting task time on the web app is finicky poor ui on the tablet app,0.0,0.181,0.819,-0.4767,negative
