reviews,clean_text,Positive,Negative,Neutral,Compound,Sentiment
"I really can't speak to the full experience, because I do not have the premium version, but so far the free version has helped me with keeping my projects and tasks in one place. I am still getting the hang of prioritizing, but that is more of a personal thing.",i really cant speak to the full experience because i do not have the premium version but so far the free version has helped me with keeping my projects and tasks in one place i am still getting the hang of prioritizing but that is more of a personal thing,0.097,0.0,0.903,0.7046,positive
Add habit track and focus mode just like in tick tick app (your competitors). Over all I like tick tick more because of these features but because that company is based in China really concerned about data protection laws. That is the only reason I will stick with todoist. Pls add gamified habit track and focus mode,add habit track and focus mode just like in tick tick app your competitors over all i like tick tick more because of these features but because that company is based in china really concerned about data protection laws that is the only reason i will stick with todoist pls add gamified habit track and focus mode,0.087,0.0,0.913,0.4497,positive
"Some functions are frustrating. I was trying to enter tasks as theyre described in an assignment with things like part a, b, or c, but it always changed anything with a part ""a"" to a time. If I manually changed it so there was no time, it deleted the rest of the text.",some functions are frustrating i was trying to enter tasks as theyre described in an assignment with things like part a b or c but it always changed anything with a part a to a time if i manually changed it so there was no time it deleted the rest of the text,0.036,0.105,0.859,-0.526,negative
"Makes a less-than-good first impression on new users by makng word input as scheduling as cryptic as possible and having no undo for marking things done, or way of looking up what you accidentally marked as done. A pain in the neck in many ways.",makes a lessthangood first impression on new users by makng word input as scheduling as cryptic as possible and having no undo for marking things done or way of looking up what you accidentally marked as done a pain in the neck in many ways,0.039,0.162,0.799,-0.7184,negative
Definitely needs a way to have a daily to-do list. Add a feature where I can put items like 'make bed' and 'meditate' as daily tasks and not have to type them in everyday and it's a 5 star app. Just looking for a way to open the app and start chocking daily tasks off without making a long list everyday over and over.,definitely needs a way to have a daily todo list add a feature where i can put items like make bed and meditate as daily tasks and not have to type them in everyday and its a  star app just looking for a way to open the app and start chocking daily tasks off without making a long list everyday over and over,0.088,0.0,0.912,0.6369,positive
I was very pleased with Todoist app for quite some time (I am paid /premium member) but since last 2-3 days ago the app stopped working correctly : push notifications stopped working and I am not getting push notification reminders on my android phone anymore. Please fix this bug as this is the only reason I need app at all. Thanks 🙏,i was very pleased with todoist app for quite some time i am paid premium member but since last  days ago the app stopped working correctly  push notifications stopped working and i am not getting push notification reminders on my android phone anymore please fix this bug as this is the only reason i need app at all thanks ,0.14,0.074,0.786,0.6365,positive
"Good functionally but slow app. The widget almost never updates, and the app itself lags heavily on ticking off items. This didn't used to be the case but is also true for the Windows app to now. Unless this is improved I doubt I'll be resubbing.",good functionally but slow app the widget almost never updates and the app itself lags heavily on ticking off items this didnt used to be the case but is also true for the windows app to now unless this is improved i doubt ill be resubbing,0.166,0.173,0.661,-0.1027,negative
"I live my life by this app. I will forget EVERY thing I need to do if Todoist doesn't remind me that I need to do it. That is why I am so frustrated lately with this app. Every day I have many, many tasks that I need to know about. It seems recently that I get MAYBE 5% of them. At the end of the day I will check Todoist on my android device (Samsung Note 20 Ultra) but when I look at the list in Todoist, there are like 30 missed tasks marked in red but I NEVER got any notification.",i live my life by this app i will forget every thing i need to do if todoist doesnt remind me that i need to do it that is why i am so frustrated lately with this app every day i have many many tasks that i need to know about it seems recently that i get maybe  of them at the end of the day i will check todoist on my android device samsung note  ultra but when i look at the list in todoist there are like  missed tasks marked in red but i never got any notification,0.034,0.073,0.893,-0.3986,negative
"Seems like a good app. You need to pay if you want reminders, 5$ but I'm to already paying for so many CRMs and apps. Not one can allow me to have control over my notifications. And who knows if they even work on your phone. Probably just as good as Google calendar but for a few. God I wish I knew how to develop an app. I'm frustrated. All I want is an app that will remind me of things with a ding or whatever I choose. Google can't even get it right Soo.... Why should a $5 a month app.",seems like a good app you need to pay if you want reminders  but im to already paying for so many crms and apps not one can allow me to have control over my notifications and who knows if they even work on your phone probably just as good as google calendar but for a few god i wish i knew how to develop an app im frustrated all i want is an app that will remind me of things with a ding or whatever i choose google cant even get it right soo why should a  a month app,0.155,0.074,0.77,0.7616,positive
"[EDIT] Unfortunately since I wrote this review, Todoist has added pointless limitations and crippled the app - no more than 5 projects unless you pay *A LOT* to upgrade to professional. There's no middle ground. I think they've massively failed to understand their market. [OP] I was looking for the best alternative to Wunderlist. I think I found that in Todoist. In fact Todoist has some features I like ever better.",edit unfortunately since i wrote this review todoist has added pointless limitations and crippled the app  no more than  projects unless you pay a lot to upgrade to professional theres no middle ground i think theyve massively failed to understand their market op i was looking for the best alternative to wunderlist i think i found that in todoist in fact todoist has some features i like ever better,0.128,0.153,0.719,0.0258,neutral
"A very great app. However, just two things, and they are quite important. Tasks that are completed will not be shown if i dont choose to, and its very annoying tbh. The other thing is that i cant track down the completed tasks by searching the tags but only those incompleted, so what is the point of adding them tags into those tasks, bruh... Hence only three stars. And i noticed that there are so many cmts here complaining about the first thing i complained about.",a very great app however just two things and they are quite important tasks that are completed will not be shown if i dont choose to and its very annoying tbh the other thing is that i cant track down the completed tasks by searching the tags but only those incompleted so what is the point of adding them tags into those tasks bruh hence only three stars and i noticed that there are so many cmts here complaining about the first thing i complained about,0.048,0.088,0.864,-0.5429,negative
Loved this app until the pop up to install the widget started appearing all the time! I can't get rid of it and it's destroying my experience. I can't make a list without it appearing 2-3 times,loved this app until the pop up to install the widget started appearing all the time i cant get rid of it and its destroying my experience i cant make a list without it appearing  times,0.101,0.094,0.805,0.0772,positive
I wish I could keep the left panel menu open. I hate clicking a hamburger menu on the bottom to choose other folders,i wish i could keep the left panel menu open i hate clicking a hamburger menu on the bottom to choose other folders,0.115,0.158,0.726,-0.25,negative
"Good enough, but is not a replacement for my old character mode MS-Dos program I wrote years ago. What I need is to be able to add attributes to each task and select from a defined list of values for each attribute. I then need to be able to filter and sort by any selection of attributes and values. Labels are not enough for this. I also want to be able to report on the number of outstanding and done tasks by attribute including totalling effort estimates for each. Basically, underpin the app with a relational database and provide an SQL query facility.",good enough but is not a replacement for my old character mode msdos program i wrote years ago what i need is to be able to add attributes to each task and select from a defined list of values for each attribute i then need to be able to filter and sort by any selection of attributes and values labels are not enough for this i also want to be able to report on the number of outstanding and done tasks by attribute including totalling effort estimates for each basically underpin the app with a relational database and provide an sql query facility,0.162,0.0,0.838,0.9473,positive
"Love the app, but I'm running into an issue where I try to show completed tasks in a project and it says there aren't any. This issue is fixed by going onto desktop and doing the same thing, but I'd like to see it fixed in the app.",love the app but im running into an issue where i try to show completed tasks in a project and it says there arent any this issue is fixed by going onto desktop and doing the same thing but id like to see it fixed in the app,0.117,0.0,0.883,0.705,positive
"Looks good, but is for me worthless without notifications. And then 3-4 $ per month in order to activate notifications is way too much. Maybe 1 $ could have been worth in order to move away from Microsoft's free TODO app.",looks good but is for me worthless without notifications and then   per month in order to activate notifications is way too much maybe   could have been worth in order to move away from microsofts free todo app,0.192,0.084,0.724,0.5994,positive
"Doesn't allow multiple calendars to be synced, making it useless if you're someone that wants to use this for work and personal. Also no proper calendar view. Anydo does both of these things.",doesnt allow multiple calendars to be synced making it useless if youre someone that wants to use this for work and personal also no proper calendar view anydo does both of these things,0.0,0.182,0.818,-0.6874,negative
"This app used to be perfect until they started collapsing all the tasks into one notification. This makes it too easy to ignore, severely limiting the usefulness of the app. Edit: No I'm not going to submit a ticket. Do the work yourself or pay me to do it.",this app used to be perfect until they started collapsing all the tasks into one notification this makes it too easy to ignore severely limiting the usefulness of the app edit no im not going to submit a ticket do the work yourself or pay me to do it,0.146,0.188,0.666,-0.128,negative
"The UI looks great. Love the dark theme. Problem is I downloaded this app because it was advertising watch compatibility in the pictures but the app is nowhere to be found on my Galaxy Watch Active, which was the only reason I chose this specific app.",the ui looks great love the dark theme problem is i downloaded this app because it was advertising watch compatibility in the pictures but the app is nowhere to be found on my galaxy watch active which was the only reason i chose this specific app,0.172,0.037,0.791,0.7814,positive
"Crashing frequently when interacting with ""boards"" or items that were recently moved. Other than that I think the app is pretty well put together.",crashing frequently when interacting with boards or items that were recently moved other than that i think the app is pretty well put together,0.202,0.0,0.798,0.6486,positive
"I wish widget would have a very compact design, just a list of tasks, nothing more -- no menu bar, no headers, etc. As for me, the widget eats too much of homescreen space and is not optimised.",i wish widget would have a very compact design just a list of tasks nothing more  no menu bar no headers etc as for me the widget eats too much of homescreen space and is not optimised,0.176,0.058,0.766,0.5649,positive
"The mobile version is great, but is there a reason that the web interface is suddenly so slow and unwieldy? It's been a few weeks now, so I'm deleting this app and creating lists on a new app, in case anyone has any recommendations.",the mobile version is great but is there a reason that the web interface is suddenly so slow and unwieldy its been a few weeks now so im deleting this app and creating lists on a new app in case anyone has any recommendations,0.121,0.0,0.879,0.6542,positive
"it was easy to use the first few days, but now it's only adding everyday things (like feeding my dogs) to my list every other day, and not letting me fix it. it also doesn't send notifications so in order to remember my todo list I have to remember to open an app with my todo list.",it was easy to use the first few days but now its only adding everyday things like feeding my dogs to my list every other day and not letting me fix it it also doesnt send notifications so in order to remember my todo list i have to remember to open an app with my todo list,0.088,0.0,0.912,0.6369,positive
"it's a good app and easy to use, but when I try to reorder and arrange a list, it goes back to the order it was in before I tried to reorder it. in short, reordering lists doesn't work.",its a good app and easy to use but when i try to reorder and arrange a list it goes back to the order it was in before i tried to reorder it in short reordering lists doesnt work,0.106,0.0,0.894,0.4404,positive
What I'm looking for is scheduling calls. Not just typing call so and so but click on call button and my contacts would pop up to choose from. When you have this I'll gladly pay a fee and will be strong proponent of the app.,what im looking for is scheduling calls not just typing call so and so but click on call button and my contacts would pop up to choose from when you have this ill gladly pay a fee and will be strong proponent of the app,0.141,0.112,0.747,0.3767,positive
"Used to love this app, but the new widget is ugly, unreadable, and too easy to accidentally check something. I'll be looking for a replacement if this hasn't been fixed by the time my subscription runs out.",used to love this app but the new widget is ugly unreadable and too easy to accidentally check something ill be looking for a replacement if this hasnt been fixed by the time my subscription runs out,0.132,0.231,0.637,-0.7003,negative
"The app itself is totally fine. I've been using it extensively both for my personal and work GTD-management, the app has a lot of my personal data, activity and thoughts. I'm becoming more and more aware and worried about my digital privacy. Can't be overly careful with these things today. I don't use external authentication in Todoist because I don't want to randomly lose my account after some random ban in Google/FB. But I desperately need 2FA protection in Todoist! We're waiting for too long!",the app itself is totally fine ive been using it extensively both for my personal and work gtdmanagement the app has a lot of my personal data activity and thoughts im becoming more and more aware and worried about my digital privacy cant be overly careful with these things today i dont use external authentication in todoist because i dont want to randomly lose my account after some random ban in googlefb but i desperately need fa protection in todoist were waiting for too long,0.018,0.133,0.849,-0.7946,negative
Please reduce the font size in widget so that more items can be shown in a smaller window. There are not so many options so it shouldn't be any issues with click target size etc. Check how Google Calendar widget shows information in agenda mode.,please reduce the font size in widget so that more items can be shown in a smaller window there are not so many options so it shouldnt be any issues with click target size etc check how google calendar widget shows information in agenda mode,0.051,0.0,0.949,0.3182,positive
"I love everything about this app, especially the website which was great guides and blog posts, but a deal breaker for me is that the widget does not sync with your device theme (the app itself does, fortunately). Please change this!",i love everything about this app especially the website which was great guides and blog posts but a deal breaker for me is that the widget does not sync with your device theme the app itself does fortunately please change this,0.184,0.0,0.816,0.7964,positive
"I have been using it for years now, but the windows version is still not as perfect as Android version. When I open the windows 10 version of todoist, the app load takes too long",i have been using it for years now but the windows version is still not as perfect as android version when i open the windows  version of todoist the app load takes too long,0.0,0.114,0.886,-0.612,negative
"Just migrated to Tick Tick - it's better with more holistic useful functionality and cheaper with free version having not that much restrictions like in Todoist. Sorry guys, it seems you have some work to do if you want to stay competitive.",just migrated to tick tick  its better with more holistic useful functionality and cheaper with free version having not that much restrictions like in todoist sorry guys it seems you have some work to do if you want to stay competitive,0.297,0.026,0.678,0.9114,positive
"When you complete a task it disappears!! Not a good function - means you can't remember what you accomplished, and you don't get the satisfaction of seeing a big list of things crossed out (something list makers love!)",when you complete a task it disappears not a good function  means you cant remember what you accomplished and you dont get the satisfaction of seeing a big list of things crossed out something list makers love,0.164,0.167,0.67,0.2235,positive
"Pretty good but when I'm adding a reminder please don't assume the time will earlier in the day than the current time. Also, it goes a little haywire during the transition to/from Daylight Savings Time.",pretty good but when im adding a reminder please dont assume the time will earlier in the day than the current time also it goes a little haywire during the transition tofrom daylight savings time,0.189,0.0,0.811,0.7184,positive
"I enjoy it for what its worth, with a nice interface and customisation, but basic features like reminders for tasks are subscription only, which defeats the second bullet point in the app description.",i enjoy it for what its worth with a nice interface and customisation but basic features like reminders for tasks are subscription only which defeats the second bullet point in the app description,0.231,0.078,0.691,0.5789,positive
"So far Todoist has worked fine, but the fact they want you to pay a monthly fee to set a ""reminder"" is ridiculous. So many times I'm in the middle of something and can't finish a task right then and I want to be able to set a reminder. Time to move on to another app.",so far todoist has worked fine but the fact they want you to pay a monthly fee to set a reminder is ridiculous so many times im in the middle of something and cant finish a task right then and i want to be able to set a reminder time to move on to another app,0.078,0.088,0.834,-0.3716,negative
"There is a bug in the app. After i deleted one of the templates i got from the todoist app, it wont open anymore. I set up all daily routines from another app. This is very annoying.",there is a bug in the app after i deleted one of the templates i got from the todoist app it wont open anymore i set up all daily routines from another app this is very annoying,0.0,0.086,0.914,-0.4576,negative
"Can you fix the bug where when adding a task, the keyboard fills up past the options that lets you select priority and projects? It's not critical but it's annoying to see at a UX level",can you fix the bug where when adding a task the keyboard fills up past the options that lets you select priority and projects its not critical but its annoying to see at a ux level,0.04,0.096,0.864,-0.4712,negative
"New update has caused a lot of issues with the widget. Every time I complete a task, it resets to load my list from the top. I need to scroll down every single time. Please fix.",new update has caused a lot of issues with the widget every time i complete a task it resets to load my list from the top i need to scroll down every single time please fix,0.12,0.0,0.88,0.4767,positive
Generally very good. I have a few problems when I use it for reminders. working out what I need to write for a week of reminders in 10 days time is a bit challenging.,generally very good i have a few problems when i use it for reminders working out what i need to write for a week of reminders in  days time is a bit challenging,0.152,0.086,0.762,0.2716,positive
"Tried it, but have found some smoother apps. The dates (how the dates function) on the task list became way to cumbersome. Need something more like a backlog. A bit pricey.",tried it but have found some smoother apps the dates how the dates function on the task list became way to cumbersome need something more like a backlog a bit pricey,0.116,0.0,0.884,0.5704,positive
"Its a good list app. But the reason why i give it a low response is that you have to pay a subscription to be able to use things such as reminders and alarms, which i need to be able to even remember that i have a list of things i need to do on a daily basis. Apart from that solid app.",its a good list app but the reason why i give it a low response is that you have to pay a subscription to be able to use things such as reminders and alarms which i need to be able to even remember that i have a list of things i need to do on a daily basis apart from that solid app,0.064,0.115,0.82,-0.4678,negative
"It works, but many of the best features are behind a subscription. I'd consider a one-time purchase, but the app definitely isn't worth what a year's subscription would cost.",it works but many of the best features are behind a subscription id consider a onetime purchase but the app definitely isnt worth what a years subscription would cost,0.272,0.058,0.67,0.8538,positive
"I liked the app, it was missing a few things but It was okay. I uninstalled it at one point, until I decided if I wanted to keep it, but I am still getting notified for the reminders. It is incredibly annoying and I can't figure out why... Edit: Thanks for the help, the problem is now that I don't know what account I logged in with.",i liked the app it was missing a few things but it was okay i uninstalled it at one point until i decided if i wanted to keep it but i am still getting notified for the reminders it is incredibly annoying and i cant figure out why edit thanks for the help the problem is now that i dont know what account i logged in with,0.162,0.127,0.71,0.3634,positive
sync between gcal was so bad that I wasted plenty of time waiting to add a single task. For almost half a year it worked fairly nice but that problems with sync today was enough to lose any trust for keeping important task on that platform,sync between gcal was so bad that i wasted plenty of time waiting to add a single task for almost half a year it worked fairly nice but that problems with sync today was enough to lose any trust for keeping important task on that platform,0.151,0.213,0.636,-0.5465,negative
"Widget flickering since latest update... every 8 seconds the widget briefly flashes ""No tasks"", then goes back to normal. Have removed and re-added the widget. Haven't tried reinstalling yet. Samsung S7 (yes, still going strong! ;) )",widget flickering since latest update every  seconds the widget briefly flashes no tasks then goes back to normal have removed and readded the widget havent tried reinstalling yet samsung s yes still going strong,0.157,0.058,0.785,0.5859,positive
In general I like the app. I had to downgrade two stars though because there seems to be a bug. I use a widget on my home screen to see my tasks and lately the widget is acting up. It blinks on and off constantly. This just started happening recently on my Pixel 6.,in general i like the app i had to downgrade two stars though because there seems to be a bug i use a widget on my home screen to see my tasks and lately the widget is acting up it blinks on and off constantly this just started happening recently on my pixel,0.051,0.0,0.949,0.3612,positive
"I actually really loved the app, but they changed the widget size. Now it's really wide and very short which doesn't allow you to see very many tasks at all and doesn't fit on the screen very well.",i actually really loved the app but they changed the widget size now its really wide and very short which doesnt allow you to see very many tasks at all and doesnt fit on the screen very well,0.131,0.108,0.761,0.2551,positive
