reviews,clean_text,Positive,Negative,Neutral,Compound,Sentiment
"SEIZURE RISK!!!! I have had this app for years and recommended it to many people, as it worked perfectly for me. After the latest update, however, the widget became stuck in a constant reload cycle that causes it to strobe on the screen. I immediately tried to delete the widget, but the upload cycle prevents you from being able to delete the widget as well. It almost triggered a seizure. The developers need to fix whatever mistake they made in the update ASAP.",seizure risk i have had this app for years and recommended it to many people as it worked perfectly for me after the latest update however the widget became stuck in a constant reload cycle that causes it to strobe on the screen i immediately tried to delete the widget but the upload cycle prevents you from being able to delete the widget as well it almost triggered a seizure the developers need to fix whatever mistake they made in the update asap,0.094,0.071,0.835,0.2382,positive
"It's been three months and the app still stops syncing periodically. It just hangs, as does the widget. The only way to recover is to delete the app's local data. And their support email address listed in the Play Store is still the same one that they don't actually support. I think it's time to finally give up :(",its been three months and the app still stops syncing periodically it just hangs as does the widget the only way to recover is to delete the apps local data and their support email address listed in the play store is still the same one that they dont actually support i think its time to finally give up,0.125,0.026,0.849,0.7351,positive
"One of the main sticking points for me is how well an app does recurring tasks. In particular, not just fixed date recurrences, but the ability to set the next date off the last completion date. So many apps fail to offer this. Alas, I could find NO way to do a recurring task at all, in spite of them saying it can be done. So, much less checking on this nuance, I see no way of doing them at all. Fail. Moving on.",one of the main sticking points for me is how well an app does recurring tasks in particular not just fixed date recurrences but the ability to set the next date off the last completion date so many apps fail to offer this alas i could find no way to do a recurring task at all in spite of them saying it can be done so much less checking on this nuance i see no way of doing them at all fail moving on,0.045,0.233,0.722,-0.9685,negative
"What is the point of a ""To Do"" list without reminders? Nope, you don't get a notification reminder unless you pay for premium, you can't even try it to see if it will work better than Microsoft To-Do (which can't stay running for anything). Without notifications/alarms I can make a ""To Do"" list using a notebook & pen or the paper calendar I have on my fridge! The whole point of searching for a useful app is to use modern features, like reminders/alarms & custom days, dates, & times.",what is the point of a to do list without reminders nope you dont get a notification reminder unless you pay for premium you cant even try it to see if it will work better than microsoft todo which cant stay running for anything without notificationsalarms i can make a to do list using a notebook  pen or the paper calendar i have on my fridge the whole point of searching for a useful app is to use modern features like remindersalarms  custom days dates  times,0.098,0.017,0.885,0.7845,positive
"To start, notifications shouldn't be a premium feature. The main reason I want a to-do list on my phone is so I can get more from it, including reminders. Second, even the free features didn't function as the guide said they would. I tried to add a recurring task for Monday, Wednesday and Friday, as per the instructions, but it wouldn't even do that. Edit2: sent image confirming smart recog is on, but you can't screenshot with the keyboard on and cannot turn keyboard off while setting time.",to start notifications shouldnt be a premium feature the main reason i want a todo list on my phone is so i can get more from it including reminders second even the free features didnt function as the guide said they would i tried to add a recurring task for monday wednesday and friday as per the instructions but it wouldnt even do that edit sent image confirming smart recog is on but you cant screenshot with the keyboard on and cannot turn keyboard off while setting time,0.08,0.0,0.92,0.705,positive
"No easy way to view your completed tasks. Everything else about this app is great, but this one missing feature is a HUGE dealbreaker. For 90% of people, the benefit of a todo list is to see what you have done easily, and get a sense of achievement from it. If they added that feature I'd give it 5 stars, but I find this app unusable without this feature.",no easy way to view your completed tasks everything else about this app is great but this one missing feature is a huge dealbreaker for  of people the benefit of a todo list is to see what you have done easily and get a sense of achievement from it if they added that feature id give it  stars but i find this app unusable without this feature,0.194,0.059,0.747,0.8793,positive
"I recently completed the forced upgrade for the app, and now it doesn't work consistently.....repeatedly, the app has frozen up completely and none of my tasks appear. If I'm able to get it working again (aftet multiple restarts), all the changes i made in recent sessions are gone. It worked perfectly before. I'm SO annoyed! I've been a todoist user for years, but if this isn't fixed, I'll switch to something that works consistently (already made that switch, for work projects).",i recently completed the forced upgrade for the app and now it doesnt work consistentlyrepeatedly the app has frozen up completely and none of my tasks appear if im able to get it working again aftet multiple restarts all the changes i made in recent sessions are gone it worked perfectly before im so annoyed ive been a todoist user for years but if this isnt fixed ill switch to something that works consistently already made that switch for work projects,0.067,0.05,0.883,0.3431,positive
"Worthless app. Have been using the premium version for 6 months now, and much preferred the previous free version from over a year ago that had the auto reschedule function in case you actually try to intentionally write down more than you can accomplish in a day to make sure things don't fall through the crack. Wish I had known thay feature was removed before purchasing, but without it, it's actually more work than just writing it as a simple checklist.",worthless app have been using the premium version for  months now and much preferred the previous free version from over a year ago that had the auto reschedule function in case you actually try to intentionally write down more than you can accomplish in a day to make sure things dont fall through the crack wish i had known thay feature was removed before purchasing but without it its actually more work than just writing it as a simple checklist,0.094,0.024,0.882,0.5574,positive
I set multiple test reminders to see what kind of notification I'd receive and I haven't gotten a single one. I checked permissions and settings to make sure nothing turned off by default. I set a few at different times for reminders and they all passed by with nothing. No push or emails or anything. I can't exactly recommend using a reminder app that doesn't actually give you reminders.,i set multiple test reminders to see what kind of notification id receive and i havent gotten a single one i checked permissions and settings to make sure nothing turned off by default i set a few at different times for reminders and they all passed by with nothing no push or emails or anything i cant exactly recommend using a reminder app that doesnt actually give you reminders,0.065,0.033,0.902,0.2681,positive
"Downloaded the app so I could have a widget with my list on my home screen. shortly thereafter, tney added checkboxes, which can't be turned off, making it easy to accidentally ""complete"" a task on the widget. And unlike when you have the app open, this can't be undone. It was good when I downloaded it, but is now completely useless.",downloaded the app so i could have a widget with my list on my home screen shortly thereafter tney added checkboxes which cant be turned off making it easy to accidentally complete a task on the widget and unlike when you have the app open this cant be undone it was good when i downloaded it but is now completely useless,0.062,0.093,0.845,-0.4478,negative
I really wanted to like this app but there is no way to order items on todo lists. I have at this point had to reorder all of my items over 10 times for each because when u use the drag and drop menu to change the order it doesn't save it permanently there is also no way to sort your todo lists by date because I figured if I input a deadline for each item it would show me what I had to do with the one due the soonest at the top but no. I wish there were more ways to sort or at least filter date,i really wanted to like this app but there is no way to order items on todo lists i have at this point had to reorder all of my items over  times for each because when u use the drag and drop menu to change the order it doesnt save it permanently there is also no way to sort your todo lists by date because i figured if i input a deadline for each item it would show me what i had to do with the one due the soonest at the top but no i wish there were more ways to sort or at least filter date,0.066,0.146,0.788,-0.8485,negative
Used to be simple well organized app. Latest update was a major step backwards and makes it unusable and completely unreliable. Do not trust them with your data.... Most of my prior history of completed tasks disappeared. For some reason timed ones seemed to stick around... Completed tasks are now automatically hidden and lose any order you had them in. If you ever care to reference completed tasks in any structure this app is not for you. It's a hot mess now for that. And their backups do not include completed tasks. They claim all your information is backed up securely but when I asked for my completed tasks they were not able to provide my attachments.,used to be simple well organized app latest update was a major step backwards and makes it unusable and completely unreliable do not trust them with your data most of my prior history of completed tasks disappeared for some reason timed ones seemed to stick around completed tasks are now automatically hidden and lose any order you had them in if you ever care to reference completed tasks in any structure this app is not for you its a hot mess now for that and their backups do not include completed tasks they claim all your information is backed up securely but when i asked for my completed tasks they were not able to provide my attachments,0.075,0.057,0.868,0.2844,positive
"Needed a good list for Wear OS use only (no phone), and this was almost perfect --- except there's no confirmation when marking a list item complete, so it's really easy to accidentally remove an item unintentionally, and it's impossible to undo a completion from the watch interface. So close, and yet so far.",needed a good list for wear os use only no phone and this was almost perfect  except theres no confirmation when marking a list item complete so its really easy to accidentally remove an item unintentionally and its impossible to undo a completion from the watch interface so close and yet so far,0.161,0.116,0.723,0.5719,positive
"I used the app for about 3 days before realizing it wasn't a good fit for me. I wanted to use the widget more than the app itself, but I was frustrated with the way recurring events and subtasks work. I even checked reddit and online for a solution, but without success. Instead of listing subtasks as same priority as the parent task during scheduling, I wanted things to remain nested and recurring. After attempting to make things work, I gave up and tried TickTick instead, which has been better!",i used the app for about  days before realizing it wasnt a good fit for me i wanted to use the widget more than the app itself but i was frustrated with the way recurring events and subtasks work i even checked reddit and online for a solution but without success instead of listing subtasks as same priority as the parent task during scheduling i wanted things to remain nested and recurring after attempting to make things work i gave up and tried ticktick instead which has been better,0.073,0.127,0.801,-0.6193,negative
"The popups you've started to do when X amount of tasks are completed just get in the way. Especially on the app, it takes up most of the screen and has to be navigated away from. It may work in some scenarios but not all, give me an option to turn it off please. I don't want to be congratulated for achieving my 5th task of the day, especially when all I've done is tick off ""bananas"" from a shopping list, I just want to see what's next.",the popups youve started to do when x amount of tasks are completed just get in the way especially on the app it takes up most of the screen and has to be navigated away from it may work in some scenarios but not all give me an option to turn it off please i dont want to be congratulated for achieving my th task of the day especially when all ive done is tick off bananas from a shopping list i just want to see whats next,0.034,0.031,0.935,0.3147,positive
"Started using this app and loved it. I was thinking about buying the full version but... All of sudden it won't add tasks, they just don't appear and can't do anything, delete, move, nothing! The only way to fix it is to restart my phone. I'm trying to put together a new to-do list and have already restarted my phone 5 times, I give up!",started using this app and loved it i was thinking about buying the full version but all of sudden it wont add tasks they just dont appear and cant do anything delete move nothing the only way to fix it is to restart my phone im trying to put together a new todo list and have already restarted my phone  times i give up,0.039,0.0,0.961,0.3506,positive
AVOID! Constant email spam and the developers made sure deleting your account is nigh impossible. I was trying to create a password for my account on their site and it said my password may have been exposed to a security breach... my password that doesn't exist. The app keeps giving me errors when I try to set up a password... still working on it. AVOID THIS PLAUGE!,avoid constant email spam and the developers made sure deleting your account is nigh impossible i was trying to create a password for my account on their site and it said my password may have been exposed to a security breach my password that doesnt exist the app keeps giving me errors when i try to set up a password still working on it avoid this plauge,0.126,0.146,0.728,-0.1027,negative
"I complained that the widget keeps flashing so they said to update to v10908 or try to delete and reinstall. But I'd already tried deleting and reinstalling, which didn't help. And the version released a few days ago on the Android app store is 10902, and that's all that's available. No 10908.",i complained that the widget keeps flashing so they said to update to v or try to delete and reinstall but id already tried deleting and reinstalling which didnt help and the version released a few days ago on the android app store is  and thats all thats available no,0.0,0.146,0.854,-0.7606,negative
"This is a simple todo app and it's full of bugs - didn't receive notifications after going Pro, and couldn't even submit a support ticket (which they have washed their hands of). The ""natural language"" prediction of times from text is just an irritant and very odd UI on rescheduling tasks. Avoid, it's overpriced and badly implemented.",this is a simple todo app and its full of bugs  didnt receive notifications after going pro and couldnt even submit a support ticket which they have washed their hands of the natural language prediction of times from text is just an irritant and very odd ui on rescheduling tasks avoid its overpriced and badly implemented,0.039,0.21,0.751,-0.8736,negative
I just wanted to make a list so I would not forget some things. I could not sign up because my password is too easy. I don't care if someone else sees that I have to buy flour at the store or that I am having my tires rotated on Tuesday. I only remember a couple of my passwords. If I have to remember one more for an app I would would be better off just writing down what I need to do. I don't care who reads it I am deleting this app,i just wanted to make a list so i would not forget some things i could not sign up because my password is too easy i dont care if someone else sees that i have to buy flour at the store or that i am having my tires rotated on tuesday i only remember a couple of my passwords if i have to remember one more for an app i would would be better off just writing down what i need to do i dont care who reads it i am deleting this app,0.088,0.06,0.852,0.3556,positive
"Subscription based. £50 a year. For a todo list app. No. Imagine you put 10 or 20 similarly priced apps on your phone, you're losing £500 to £1000 per year, the price of a flagship phone! Every year! I'd have paid between £5 and £10 max for this app for the pro features. I'll look elsewhere, I'm not going to encourage this greed.",subscription based £ a year for a todo list app no imagine you put  or  similarly priced apps on your phone youre losing £ to £ per year the price of a flagship phone every year id have paid between £ and £ max for this app for the pro features ill look elsewhere im not going to encourage this greed,0.023,0.217,0.76,-0.9006,negative
"Unable to set tasks by multiple recurrence, only useful if you have a different deadline or specifc day for every single task. Unable to set read one chapter on odd (M/W/F) weekdays at 3pm. Can't plan anything with this ""planner"". No real automated planning, such as calculating daily task per specified workdays to complete a 3000 word essay by specified deadline. The prompt you provided did not work.",unable to set tasks by multiple recurrence only useful if you have a different deadline or specifc day for every single task unable to set read one chapter on odd mwf weekdays at pm cant plan anything with this planner no real automated planning such as calculating daily task per specified workdays to complete a  word essay by specified deadline the prompt you provided did not work,0.042,0.065,0.893,-0.1531,negative
"I have one day using this (desktop) app and i have experienced enormous frustration. The second you click on completed, the task disappears fron earth as if you never even typed it in. Yousearch for an option called show completed, but it keeps hiding the completed every click. It doesn't store any of the settings, and it is buggy to the point that it will randomly show you what you previously had while it staggers. Forget about task history. NLP works but hides the tasks you used it for! Sad.",i have one day using this desktop app and i have experienced enormous frustration the second you click on completed the task disappears fron earth as if you never even typed it in yousearch for an option called show completed but it keeps hiding the completed every click it doesnt store any of the settings and it is buggy to the point that it will randomly show you what you previously had while it staggers forget about task history nlp works but hides the tasks you used it for sad,0.0,0.156,0.844,-0.9201,negative
"Subscription is to expensive for supported features. It is not easy to oversee all the things gooing on. I could not create ""subsections"" in my personal routines section to keep things stuffed. Also it is not possible to mark something as ""not done"". Especially for reoccuring routines this would make perfectly sence. Another rather bad thing is, that it is not easy to analyze progress or precission. Especially for routines a statistical analysis would be good. Also a visualization for due dates.",subscription is to expensive for supported features it is not easy to oversee all the things gooing on i could not create subsections in my personal routines section to keep things stuffed also it is not possible to mark something as not done especially for reoccuring routines this would make perfectly sence another rather bad thing is that it is not easy to analyze progress or precission especially for routines a statistical analysis would be good also a visualization for due dates,0.131,0.109,0.761,0.4721,positive
Free version doesn't have notifications for REMINDERS! What a scam! What is the point of having this app if it doesn't have freaking reminders? Like that's literally the entire point of this app. Shame on you guys.,free version doesnt have notifications for reminders what a scam what is the point of having this app if it doesnt have freaking reminders like thats literally the entire point of this app shame on you guys,0.177,0.148,0.675,0.0854,positive
I've been a paying user for many years but looking for something better now. Reminders are only reminding sometimes since recent updates. Very disappointed.,ive been a paying user for many years but looking for something better now reminders are only reminding sometimes since recent updates very disappointed,0.131,0.156,0.713,-0.1875,negative
"The app is too complicated and has too many features that are not intuitive or user-friendly,too expensive and requires a premium subscription to access most features1too buggy and has sync issues, data loss, crashes, and glitches,The app is too restrictive and does not allow users to customize their tasks, projects, or labelsThe app is too slow and consumes a lot of battery and memory",the app is too complicated and has too many features that are not intuitive or userfriendlytoo expensive and requires a premium subscription to access most featurestoo buggy and has sync issues data loss crashes and glitchesthe app is too restrictive and does not allow users to customize their tasks projects or labelsthe app is too slow and consumes a lot of battery and memory,0.0,0.062,0.938,-0.4526,negative
"This app was good to use for a while, but when it started to glitch on me, tech support was not helpful. They kept telling me they were working on the issue but never fixed it. The app was nice to use and helpful, but if it ever stops working customer service is no where to be found. It's not worth the money or the headache.",this app was good to use for a while but when it started to glitch on me tech support was not helpful they kept telling me they were working on the issue but never fixed it the app was nice to use and helpful but if it ever stops working customer service is no where to be found its not worth the money or the headache,0.117,0.161,0.722,-0.3601,negative
"Not a good first impression. Too easy to press a wrong fuction (e.g. check boxes) thinking it initiates a section when it clears the section instead (confetti streams down and section dissapears). No way to undelete. Also, when selecting any ""help"" or ""contact"" info, screen clears and shows, ""Application error: a client-side exception has occurred (see the browser console for more information).""",not a good first impression too easy to press a wrong fuction eg check boxes thinking it initiates a section when it clears the section instead confetti streams down and section dissapears no way to undelete also when selecting any help or contact info screen clears and shows application error a clientside exception has occurred see the browser console for more information,0.118,0.174,0.707,-0.5956,negative
Downloaded today and the app generates an error when I try to create an account. Not a great sign!,downloaded today and the app generates an error when i try to create an account not a great sign,0.095,0.271,0.634,-0.5986,negative
"Came as preinstalled bloat. Decided to open it and see if it was any good. I logged in, and immediately began receiving spam from them in my email.",came as preinstalled bloat decided to open it and see if it was any good i logged in and immediately began receiving spam from them in my email,0.095,0.082,0.822,0.1027,positive
Garbage app. The worst? Maybe. Clearly the result of Microsoft hiring for diversity not talent or qualifications which is company wide and why they haven't done anything good in 20 years,garbage app the worst maybe clearly the result of microsoft hiring for diversity not talent or qualifications which is company wide and why they havent done anything good in  years,0.072,0.235,0.693,-0.7301,negative
Editing (changing) the timing and frequency of recurring events is infuriating enough for me to give it only one star. This should be one of the most fundamental and easiest things to do in an app that bills itself as a top notch time management/ PM tool.,editing changing the timing and frequency of recurring events is infuriating enough for me to give it only one star this should be one of the most fundamental and easiest things to do in an app that bills itself as a top notch time management pm tool,0.095,0.066,0.839,0.1189,positive
"The February 8th release is completely broken. Will not sync. If you try to update a task it will crash. It seems as if there was no testing done on this! And now five days later, still no fix. If you have not upgraded don't.",the february th release is completely broken will not sync if you try to update a task it will crash it seems as if there was no testing done on this and now five days later still no fix if you have not upgraded dont,0.0,0.208,0.792,-0.8588,negative
